question,document
Can I enroll in the course now that it's already started?,74eb249bbf
Is it still possible to join the LLM Zoomcamp after it began?,74eb249bbf
Do I need to catch up on missed material if I sign up late?,74eb249bbf
Will I be able to get the certificate if I join mid-course?,74eb249bbf
What’s the deadline for submitting the final project for certification?,74eb249bbf
When will I get a confirmation email after registering for LLM Zoomcamp?,977bf7786c
Do I need to wait for a confirmation email before starting the Zoomcamp?,977bf7786c
Is a confirmation email required to submit homework for LLM Zoomcamp?,977bf7786c
Can I start the LLM Zoomcamp without receiving any confirmation email?,977bf7786c
What does registration for LLM Zoomcamp actually do if there's no email confirmation?,977bf7786c
Where can I find the live stream link for Office Hours?,489dd1c9d9
How do I watch the Office Hours if I’m not a presenter?,489dd1c9d9
Is there a Zoom link for the workshop sessions that students can use?,489dd1c9d9
Where are the YouTube and Slido links posted for live sessions?,489dd1c9d9
Can I ask questions in the Zoom chat during Office Hours?,489dd1c9d9
What's the recommended way to begin the LLM Zoomcamp and keep up with weekly tasks?,04919992b3
"Can I start the course anytime, and where are the videos and materials hosted?",04919992b3
How does the typical weekly workflow look like for lessons and homework?,04919992b3
Where can I find the deadlines and submit my homework for the Zoomcamp?,04919992b3
Which resources should I read first to understand the course logistics and GitHub repo?,04919992b3
How can I find my spot on the leaderboard?,c2903069a0
Why isn't my name showing up on the leaderboard?,c2903069a0
Where's the link to jump to my leaderboard record?,c2903069a0
How do I change the name that appears on the leaderboard?,c2903069a0
Do I need to add my official name to get it on my certificate?,c2903069a0
Can I get a certificate if I take the self‑paced version of the course?,69d122f12e
Do I need to join a live cohort to earn the certificate?,69d122f12e
Why aren't certificates awarded for the self‑paced track?,69d122f12e
"Is peer‑reviewing required for the certificate, and when does it happen?",69d122f12e
Can I complete the capstone and still receive a certificate without a live cohort?,69d122f12e
Can I still earn a certificate if I skip the first homework?,9f689c185f
Do I need to complete all homework to get the certificate?,9f689c185f
Is the capstone project enough for the certificate even without homework?,9f689c185f
Will missing the first assignment affect my leaderboard rank?,9f689c185f
Are homework points required for the certificate or just for ranking?,9f689c185f
Why does the homework content keep changing even after I start working on it?,96286b4be4
What does the [DRAFT] label in a homework title actually mean for us students?,96286b4be4
How can I tell if a homework assignment is officially ready to submit?,96286b4be4
"Is it safe to begin a draft homework early, or should I wait for the final version?",96286b4be4
Where can I check if the homework form is open on the course platform?,96286b4be4
When will the next LLM Zoomcamp start?,bd31146b0e
Is the LLM Zoomcamp offered in Summer 2027?,bd31146b0e
What are the dates for the upcoming course session?,bd31146b0e
Can I enroll for the next LLM Zoomcamp cohort?,bd31146b0e
When does the next cohort begin?,bd31146b0e
